{
  "schemaVersion": 1,
  "taskId": "DWI-060",
  "phase": 6,
  "state": "implemented",
  "scope": "browser",
  "environment": {
    "node": "v24.14.0",
    "os": "darwin 27.0.0 (macOS 27.0.1)",
    "host": "Claude desktop app, Code tab",
    "hostVersion": null,
    "requestedModel": "sol-approved (workpack MODEL_POLICY.json)",
    "observedModel": "claude-opus-5-5 (host system context)",
    "observedEffort": null,
    "modelObservationSource": "host system context; effort not observable in session",
    "userApproval": "user message 2026-10-21: 阅读工作包然后从00-06开始工作",
    "browser": "Chrome for Testing 151.0.7922.34 (isolated)"
  },
  "sourceCommit": "d0f6052cab379c0e746be2880f336118003083bd",
  "checks": [
    {
      "command": "node tests/browser_dwi_palettes.mjs",
      "status": "pass",
      "exitCode": 0,
      "artifactPaths": [
        "docs/evidence/dwi/phase-06/dwi-060/palette-render-report.json",
        "docs/evidence/dwi/phase-06/dwi-060/palette-contact.jpg"
      ]
    },
    {
      "command": "formative novice study",
      "status": "not-run",
      "exitCode": null,
      "artifactPaths": [
        "docs/evidence/dwi/phase-06/dwi-060/novice-study-protocol.md"
      ],
      "note": "Needs participants."
    }
  ],
  "limitations": [
    "Comprehension and preference results do not exist yet."
  ],
  "changedFiles": [
    "tests/browser_dwi_palettes.mjs",
    "tests/dwi-060.test.mjs"
  ]
}
