{
  "schemaVersion": 1,
  "taskId": "DWI-023",
  "phase": 2,
  "state": "accepted",
  "scope": "local-code",
  "environment": {
    "node": "v24.14.0",
    "os": "darwin 27.0.0 (macOS 27.0.1)",
    "host": "Claude desktop app, Code tab",
    "hostVersion": null,
    "requestedModel": "sol-approved (workpack MODEL_POLICY.json)",
    "observedModel": "claude-opus-5-5 (host system context)",
    "observedEffort": null,
    "modelObservationSource": "host system context; effort not observable in session",
    "userApproval": "user message 2026-10-21: 阅读工作包然后从00-06开始工作"
  },
  "sourceCommit": "69ddbca8aada1b6dbd97d81c9788082a274d6e1f",
  "checks": [
    {
      "command": "node --test tests/dwi-023.test.mjs",
      "status": "pass",
      "exitCode": 0,
      "artifactPaths": [
        "schemas/agent-handoff.schema.json",
        "src/adapters/agent-handoff.mjs",
        "src/core/schema.mjs"
      ]
    }
  ],
  "limitations": [
    "Handoff HTTP(S) sources are not yet bound to document.sources in the approved deck.",
    "No real agent sent a handoff; fixtures only."
  ],
  "changedFiles": [
    "schemas/agent-handoff.schema.json",
    "src/adapters/agent-handoff.mjs",
    "src/core/schema.mjs",
    "src/services/visual-api.mjs",
    "tests/dwi-023.test.mjs"
  ]
}
