{
  "schemaVersion": 1,
  "taskId": "DWI-010",
  "phase": 1,
  "state": "accepted",
  "scope": "local-code",
  "environment": {
    "node": "v24.14.0",
    "os": "darwin 27.0.0 (macOS 27.0.1)",
    "host": "Claude desktop app, Code tab",
    "hostVersion": null,
    "requestedModel": "sol-approved (workpack MODEL_POLICY.json)",
    "observedModel": "claude-opus-5-5 (host system context)",
    "observedEffort": null,
    "modelObservationSource": "host system context; effort not observable in session",
    "userApproval": "user message 2026-10-21: 阅读工作包然后从00-06开始工作"
  },
  "sourceCommit": "1499d63173668e320184cfb1a11b6eb5d9355508",
  "checks": [
    {
      "command": "node --test tests/dwi-010.test.mjs",
      "status": "pass",
      "exitCode": 0,
      "artifactPaths": [
        "themes/palettes/wesanderson.json",
        "schemas/palette-registry.schema.json",
        "src/design/palette-registry.mjs"
      ]
    },
    {
      "command": "npm run verify",
      "status": "pass",
      "exitCode": 0,
      "artifactPaths": [
        "docs/evidence/dwi/phase-01/verify-2b5c8b5.txt"
      ]
    }
  ],
  "limitations": [
    "The wesanderson LICENSE file is not yet copied into the repository; required before public distribution."
  ],
  "changedFiles": [
    "themes/palettes/wesanderson.json",
    "themes/palettes/wesanderson.screenshot-samples.json",
    "schemas/palette-registry.schema.json",
    "schemas/design-plan.schema.json",
    "src/design/palette-registry.mjs",
    "src/design/plan.mjs",
    "NOTICE.md",
    "tests/dwi-010.test.mjs"
  ]
}
