{
  "schemaVersion": 1,
  "taskId": "DWI-020",
  "phase": 2,
  "state": "accepted",
  "scope": "local-code",
  "environment": {
    "node": "v24.14.0",
    "os": "darwin 27.0.0 (macOS 27.0.1)",
    "host": "Claude desktop app, Code tab",
    "hostVersion": null,
    "requestedModel": "sol-approved (workpack MODEL_POLICY.json)",
    "observedModel": "claude-opus-5-5 (host system context)",
    "observedEffort": null,
    "modelObservationSource": "host system context; effort not observable in session",
    "userApproval": "user message 2026-10-21: 阅读工作包然后从00-06开始工作"
  },
  "sourceCommit": "69ddbca8aada1b6dbd97d81c9788082a274d6e1f",
  "checks": [
    {
      "command": "node --test tests/dwi-020.test.mjs",
      "status": "pass",
      "exitCode": 0,
      "artifactPaths": [
        "src/services/document-intake.mjs",
        "tests/dwi-020.test.mjs"
      ]
    },
    {
      "command": "npm run verify",
      "status": "pass",
      "exitCode": 0,
      "artifactPaths": [
        "docs/evidence/dwi/phase-02/verify-7b567e7.txt"
      ]
    }
  ],
  "limitations": [
    "PDF and DOCX adapters stay disabled until a parser dependency is reviewed for offline packaging and licence."
  ],
  "changedFiles": [
    "src/services/document-intake.mjs",
    "src/services/server.mjs",
    "public/studio/prompt.js",
    "public/studio/workbench.js",
    "public/kinds/visual.js",
    "public/i18n.js",
    "tests/dwi-020.test.mjs"
  ]
}
