{
  "schemaVersion": 1,
  "taskId": "DWI-031",
  "phase": 3,
  "state": "accepted",
  "scope": "local-code",
  "environment": {
    "node": "v24.14.0",
    "os": "darwin 27.0.0 (macOS 27.0.1)",
    "host": "Claude desktop app, Code tab",
    "hostVersion": null,
    "requestedModel": "sol-approved (workpack MODEL_POLICY.json)",
    "observedModel": "claude-opus-5-5 (host system context)",
    "observedEffort": null,
    "modelObservationSource": "host system context; effort not observable in session",
    "userApproval": "user message 2026-10-21: 阅读工作包然后从00-06开始工作"
  },
  "sourceCommit": "ac81cf45ad06c5b226314d2414e5b8241acd52c3",
  "checks": [
    {
      "command": "node --test tests/dwi-031.test.mjs",
      "status": "pass",
      "exitCode": 0,
      "artifactPaths": [
        "src/references/presentation.mjs",
        "tests/dwi-031.test.mjs"
      ]
    }
  ],
  "limitations": [
    "Reuses CINE-002; only the qualifier placement check is new."
  ],
  "changedFiles": [
    "src/references/presentation.mjs",
    "tests/dwi-031.test.mjs"
  ]
}
