{
  "schemaVersion": 1,
  "taskId": "DWI-063",
  "phase": 6,
  "state": "accepted",
  "scope": "local-code",
  "environment": {
    "node": "v24.14.0",
    "os": "darwin 27.0.0 (macOS 27.0.1)",
    "host": "Claude desktop app, Code tab",
    "hostVersion": null,
    "requestedModel": "sol-approved (workpack MODEL_POLICY.json)",
    "observedModel": "claude-opus-5-5 (host system context)",
    "observedEffort": null,
    "modelObservationSource": "host system context; effort not observable in session",
    "userApproval": "user message 2026-10-21: 阅读工作包然后从00-06开始工作"
  },
  "sourceCommit": "d0f6052cab379c0e746be2880f336118003083bd",
  "checks": [
    {
      "command": "node --test tests/dwi-063.test.mjs",
      "status": "pass",
      "exitCode": 0,
      "artifactPaths": [
        "docs/evidence/dwi/phase-06/report.md",
        "docs/en/handoff.md",
        "docs/zh-CN/handoff.md",
        "ROADMAP.md"
      ]
    },
    {
      "command": "npm run verify",
      "status": "pass",
      "exitCode": 0,
      "artifactPaths": [
        "docs/evidence/dwi/phase-06/verify-d0f6052.txt"
      ]
    }
  ],
  "limitations": [
    "Nothing pushed or merged; the user decides."
  ],
  "changedFiles": [
    "docs/evidence/dwi/phase-06/report.md",
    "docs/en/handoff.md",
    "docs/zh-CN/handoff.md",
    "ROADMAP.md",
    "docs/zh-CN/roadmap.md",
    "PROJECT_STATUS.json",
    "docs/current-status.json"
  ]
}
