{
  "schemaVersion": 1,
  "taskId": "DWI-033",
  "phase": 3,
  "state": "accepted",
  "scope": "browser",
  "environment": {
    "node": "v24.14.0",
    "os": "darwin 27.0.0 (macOS 27.0.1)",
    "host": "Claude desktop app, Code tab",
    "hostVersion": null,
    "requestedModel": "sol-approved (workpack MODEL_POLICY.json)",
    "observedModel": "claude-opus-5-5 (host system context)",
    "observedEffort": null,
    "modelObservationSource": "host system context; effort not observable in session",
    "userApproval": "user message 2026-10-21: 阅读工作包然后从00-06开始工作",
    "browser": "Chrome for Testing 151.0.7922.34 (isolated)"
  },
  "sourceCommit": "ac81cf45ad06c5b226314d2414e5b8241acd52c3",
  "checks": [
    {
      "command": "node --test tests/dwi-033.test.mjs",
      "status": "pass",
      "exitCode": 0,
      "artifactPaths": [
        "src/components/diagrams/render.mjs",
        "schemas/presentation-v3.schema.json"
      ]
    },
    {
      "command": "node scripts/export-targets.mjs --s9 --decks blueprint-silver-gray-editorial-en,blueprint-silver-gray-editorial-zh-CN",
      "status": "pass",
      "exitCode": 0,
      "artifactPaths": [
        "docs/evidence/dwi/phase-03/dwi-033/blueprint-en-report.json",
        "docs/evidence/dwi/phase-03/dwi-033/blueprint-zh-CN-report.json",
        "docs/evidence/dwi/phase-03/dwi-033/blueprint-en-sheet.jpg"
      ]
    },
    {
      "command": "node tests/render-baseline.mjs --write (own commit 19353c5)",
      "status": "pass",
      "exitCode": 0,
      "artifactPaths": [
        "tests/fixtures/visual/render-baseline.json"
      ]
    }
  ],
  "limitations": [
    "Mechanism edge routing is unchanged (long elbows).",
    "Edge label shapes in PowerPoint are named by position, not by edge id."
  ],
  "changedFiles": [
    "src/components/diagrams/render.mjs",
    "src/scene/web/compile.mjs",
    "schemas/presentation-v3.schema.json",
    "tests/dwi-slice.mjs",
    "tests/dwi-003.test.mjs",
    "tests/dwi-033.test.mjs"
  ]
}
